{
  "$schema": "http://json-schema.org/draft-07/schema#",
  "title": "MaterialValueSet",
  "type": "object",
  "required": ["id", "display_name", "board_values", "hand_values"],
  "properties": {
    "id": { "type": "string" },
    "display_name": { "type": "string" },
    "description": { "type": ["string", "null"] },
    "source": { "type": ["string", "null"] },
    "version": { "type": ["string", "null"] },
    "last_updated": { "type": ["string", "null"], "description": "ISO-8601 date or freeform label" },
    "board_values": {
      "type": "array",
      "minItems": 14,
      "maxItems": 14,
      "items": {
        "type": "object",
        "required": ["mg", "eg"],
        "properties": {
          "mg": { "type": "integer" },
          "eg": { "type": "integer" }
        },
        "additionalProperties": false
      }
    },
    "hand_values": {
      "type": "array",
      "minItems": 14,
      "maxItems": 14,
      "items": {
        "oneOf": [
          {
            "type": "object",
            "required": ["mg", "eg"],
            "properties": {
              "mg": { "type": "integer" },
              "eg": { "type": "integer" }
            },
            "additionalProperties": false
          },
          { "type": "null" }
        ]
      }
    }
  },
  "additionalProperties": false,
  "description": "Defines tapered material values for all shogi piece types in board and hand contexts."
}

